<?xml version="1.0" encoding="UTF-8"?>
<Models xmlns:xsi="http://www.w3.org/2001/XMLSchema-instance" xsi:noNamespaceSchemaLocation="../candydolldb.xsd" xmlns="">

	<Model firstname="Anastasia" lastname="R" birthdate="1999-04-03" tags="">
		<Sets>
			<Set name="08" date_pic="2012-09-07" date_vid="" tags=""/>
		</Sets>
	</Model>
	
	<Model firstname="Diana" lastname="H" birthdate="" tags="">
		<Sets>
			<Set name="05" date_pic="2012-09-07" date_vid="" tags=""/>
		</Sets>
	</Model>

	<Model firstname="Hanna" lastname="F" birthdate="2002-04-22" tags="">
		<Sets>
			<Set name="15" date_pic="" date_vid="2012-09-07" tags=""/>
		</Sets>
	</Model>

	<Model firstname="Katie" lastname="M" birthdate="2001-12-18" tags="">
		<Sets>
			<Set name="19" date_pic="2012-08-17" date_vid="2012-09-07" tags=""/>
		</Sets>
	</Model>
	
	<Model firstname="Margaret" lastname="M" birthdate="" tags="">
		<Sets>
			<Set name="05" date_pic="2012-08-10" date_vid="2012-09-07" tags=""/>
		</Sets>
	</Model>
	
	<Model firstname="Sabina" lastname="C" birthdate="2001-06-25" tags="">
		<Sets>
			<Set name="10" date_pic="2012-09-07" date_vid="2012-07-27" tags=""/>
		</Sets>
	</Model>
	
	<Model firstname="Alissa" lastname="P" birthdate="2003-08-20" tags="">
		<Sets>
			<Set name="16" date_pic="2012-09-07" date_vid="2012-08-10" tags=""/>
			<Set name="19" date_pic="" date_vid="2012-09-07" tags=""/>
		</Sets>
	</Model>
	
	<Model firstname="VIP" lastname="" birthdate="" tags="">
		<Sets>
			<Set name="101" date_pic="2012-09-07" date_vid="2012-06-01" tags=""/>
			<Set name="115" date_pic="" date_vid="2012-09-07" tags=""/>
		</Sets>
	</Model>
</Models>