<?xml version="1.0" encoding="UTF-8"?>
<Models xmlns:xsi="http://www.w3.org/2001/XMLSchema-instance" xsi:noNamespaceSchemaLocation="../candydolldb.xsd" xmlns="">

	<Model firstname="Alissa" lastname="P" birthdate="2003-08-20" tags="">
		<Sets>
			<Set name="20" date_pic="2012-10-05" date_vid="2012-09-14" tags=""/>
		</Sets>
	</Model>
	
	<Model firstname="Diana" lastname="H" birthdate="" tags="">
		<Sets>
			<Set name="05" date_pic="2012-09-07" date_vid="2012-10-05" tags="bare feet, bunny ears, red drapes, yellow"/>
		</Sets>
	</Model>
	
	<Model firstname="Isabella" lastname="B" birthdate="" tags="">
		<Sets>
			<Set name="03" date_pic="2012-07-27" date_vid="2010-10-05" tags="black shoes, chair, diadem, gloves, maid, red drapes, white stockings"/>
		</Sets>
	</Model>
	
	<Model firstname="Katie" lastname="M" birthdate="2001-12-18" tags="">
		<Sets>
			<Set name="22" date_pic="2012-09-14" date_vid="2010-10-05" tags=""/>
			<Set name="25" date_pic="2012-10-05" date_vid="" tags=""/>
		</Sets>
	</Model>
	
	<Model firstname="Khloe" lastname="R" birthdate="" tags="">
		<Sets>
			<Set name="03" date_pic="2012-10-05" date_vid="2012-06-22" tags=""/>
		</Sets>
	</Model>
	
	<Model firstname="Maryam" lastname="K" birthdate="" tags="">
		<Sets>
			<Set name="04" date_pic="" date_vid="2012-10-05" tags=""/>
		</Sets>
	</Model>
	
	<Model firstname="Nika" lastname="V" birthdate="" tags="">
		<Sets>
			<Set name="02" date_pic="2012-10-05" date_vid="" tags=""/>
		</Sets>
	</Model>
	
	<Model firstname="VIP" lastname="" birthdate="" tags="">
		<Sets>
			<Set name="105" date_pic="2012-10-05" date_vid="2012-06-29" tags=""/>
		</Sets>
	</Model>
	
</Models>
