<?xml version="1.0" encoding="UTF-8"?>
<Models xmlns:xsi="http://www.w3.org/2001/XMLSchema-instance" xsi:noNamespaceSchemaLocation="../candydolldb.xsd" xmlns="">

	<Model firstname="Alissa" lastname="P" birthdate="2003-08-20" tags="">
		<Sets>
			<Set name="23" date_pic="" date_vid="2012-11-16" tags=""/>			
		</Sets>
	</Model>
	
	<Model firstname="Anastasia" lastname="R" birthdate="1999-04-03" tags="">
		<Sets>
			<Set name="10" date_pic="2012-11-16" date_vid="2012-11-09" tags=""/>
		</Sets>
	</Model>
	
	<Model firstname="Diana" lastname="H" birthdate="" tags="">
		<Sets>
			<Set name="09" date_pic="2012-11-16" date_vid="" tags=""/>
		</Sets>
	</Model>
	
	<Model firstname="Elona" lastname="V" birthdate="" tags="">
		<Sets>
			<Set name="02" date_pic="" date_vid="2012-11-16" tags=""/>
		</Sets>
	</Model>
	
	<Model firstname="Eva" lastname="R" birthdate="2001-07-27" tags="">
		<Sets>
			<Set name="02" date_pic="2012-11-16" date_vid="" tags=""/>
		</Sets>
	</Model>
	
	<Model firstname="Jessica" lastname="C" birthdate="" tags="">
		<Sets>
			<Set name="01" date_pic="" date_vid="2012-11-16" tags=""/>
		</Sets>
	</Model>
	
	<Model firstname="Maryam" lastname="K" birthdate="" tags="">
		<Sets>
			<Set name="05" date_pic="" date_vid="2012-11-16" tags=""/>
		</Sets>
	</Model>
	
	<Model firstname="Yuliana" lastname="A" birthdate="" tags="">
		<Sets>
			<Set name="01" date_pic="2012-11-16" date_vid="" tags=""/>
		</Sets>
	</Model>

	<Model firstname="VIP" lastname="" birthdate="" tags="">
		<Sets>
			<Set name="111" date_pic="2012-11-16" date_vid="2012-08-10" tags=""/>
			<Set name="123" date_pic="" date_vid="2012-11-16" tags=""/>
		</Sets>
	</Model>
	
</Models>
