<?xml version="1.0" encoding="UTF-8"?>
<Models xmlns:xsi="http://www.w3.org/2001/XMLSchema-instance" xsi:noNamespaceSchemaLocation="candydolldb.xsd" xmlns="">
	<Model firstname="Alissa" lastname="P" birthdate="2003-08-20" tags="">
		<Sets>
			<Set name="16" date_pic="" date_vid="2012-08-10" tags=""/>
		</Sets>
	</Model>
	<Model firstname="Bella" lastname="K" birthdate="1999-04-11" tags="">
		<Sets>
			<Set name="05" date_pic="2012-08-10" date_vid="2012-07-20" tags=""/>
		</Sets>
	</Model>
	<Model firstname="Hanna" lastname="F" birthdate="2002-04-22" tags="">
		<Sets>
			<Set name="14" date_pic="" date_vid="2012-08-10" tags=""/>
		</Sets>
	</Model>
	<Model firstname="Isabella" lastname="B" birthdate="" tags="">
		<Sets>
			<Set name="02" date_pic="2012-07-06" date_vid="2012-08-10" tags="black bodysuit, blue carpet, chair, hair barrette, hair buns, red drapes, slippers"/>
		</Sets>
	</Model>
	<Model firstname="Kleo" lastname="M" birthdate="1999-08-16" tags="">
		<Sets>
			<Set name="04" date_pic="2012-06-08" date_vid="2012-08-10" tags="bare feet, bikini, chair, polkadot, red drapes, striped"/>
		</Sets>
	</Model>
	<Model firstname="Margaret" lastname="M" birthdate="" tags="">
		<Sets>
			<Set name="05" date_pic="2012-08-10" date_vid="" tags=""/>
		</Sets>
	</Model>
	<Model firstname="Mila" lastname="L" birthdate="1997-11-27" tags="">
		<Sets>
			<Set name="02" date_pic="2012-08-10" date_vid="" tags=""/>
		</Sets>
	</Model>
	<Model firstname="Sabina" lastname="C" birthdate="2001-06-25" tags="">
		<Sets>
			<Set name="08" date_pic="2012-08-10" date_vid="2012-06-29" tags=""/>
		</Sets>
	</Model>
</Models>