<?xml version="1.0" encoding="UTF-8"?>
<Models xmlns:xsi="http://www.w3.org/2001/XMLSchema-instance" xsi:noNamespaceSchemaLocation="../candydolldb.xsd" xmlns="">

	<Model firstname="Alissa" lastname="P" birthdate="2003-08-20" tags="">
		<Sets>
			<Set name="18" date_pic="2012-09-21" date_vid="2012-08-31" tags=""/>
		</Sets>
	</Model>
	
	<Model firstname="Anastasia" lastname="R" birthdate="1999-04-03" tags="">
		<Sets>
			<Set name="07" date_pic="2012-07-13" date_vid="2012-09-21" tags="blue stockings, chair, earrings, hair band, lace, red drapes, white"/>
		</Sets>
	</Model>
	
	<Model firstname="Diana" lastname="H" birthdate="" tags="">
		<Sets>
			<Set name="04" date_pic="2012-07-13" date_vid="2012-09-21" tags="bare feet, bikini, chair, earrings, red drapes, skipping rope"/>
		</Sets>
	</Model>
	
	<Model firstname="Isabella" lastname="B" birthdate="" tags="">
		<Sets>
			<Set name="05" date_pic="2012-09-21" date_vid="" tags=""/>
		</Sets>
	</Model>
	
	<Model firstname="Katie" lastname="M" birthdate="2001-12-18" tags="">
		<Sets>
			<Set name="23" date_pic="2012-09-21" date_vid="" tags=""/>
		</Sets>
	</Model>
	
	<Model firstname="Margaret" lastname="M" birthdate="" tags="">
		<Sets>
			<Set name="07" date_pic="" date_vid="2012-09-21" tags=""/>
		</Sets>
	</Model>
	
	<Model firstname="Sabina" lastname="C" birthdate="2001-06-25" tags="">
		<Sets>
			<Set name="11" date_pic="2012-09-14" date_vid="2012-09-21" tags=""/>
		</Sets>
	</Model>
	
	<Model firstname="Suisan" lastname="A" birthdate="" tags="">
		<Sets>
			<Set name="01" date_pic="2012-09-21" date_vid="2012-08-17" tags=""/>
		</Sets>
	</Model>
	
	<Model firstname="VIP" lastname="" birthdate="" tags="">
		<Sets>
			<Set name="103" date_pic="2012-09-21" date_vid="2012-06-15" tags=""/>
			<Set name="117" date_pic="" date_vid="2012-09-21" tags=""/>
		</Sets>
	</Model>
	
</Models>
