<?xml version="1.0" encoding="UTF-8"?>
<Models xmlns:xsi="http://www.w3.org/2001/XMLSchema-instance" xsi:noNamespaceSchemaLocation="../candydolldb.xsd" xmlns="">

	<Model firstname="Anastasia" lastname="R" birthdate="1999-04-03" tags="">
		<Sets>
			<Set name="09" date_pic="" date_vid="2012-10-12" tags=""/>
		</Sets>
	</Model>
	
	<Model firstname="Diana" lastname="H" birthdate="" tags="">
		<Sets>
			<Set name="06" date_pic="2012-10-12" date_vid="" tags=""/>
		</Sets>
	</Model>
	
	<Model firstname="Hanna" lastname="F" birthdate="2002-04-22" tags="">
		<Sets>
			<Set name="15" date_pic="2012-10-12" date_vid="2012-09-07" tags=""/>
		</Sets>
	</Model>

	<Model firstname="Isabella" lastname="B" birthdate="" tags="">
		<Sets>
			<Set name="04" date_pic="2012-09-14" date_vid="2012-10-12" tags=""/>
		</Sets>
	</Model>

	<Model firstname="Katie" lastname="M" birthdate="2001-12-18" tags="">
		<Sets>
			<Set name="23" date_pic="2012-09-21" date_vid="2012-10-12" tags=""/>
			<Set name="26" date_pic="2012-10-12" date_vid="" tags=""/>
		</Sets>
	</Model>

	<Model firstname="Lauren" lastname="F" birthdate="" tags="">
		<Sets>
			<Set name="01" date_pic="" date_vid="2012-10-12" tags=""/>
		</Sets>
	</Model>
	
	<Model firstname="Maryam" lastname="K" birthdate="" tags="">
		<Sets>
			<Set name="04" date_pic="2012-10-12" date_vid="2012-10-05" tags=""/>
		</Sets>
	</Model>

	<Model firstname="VIP" lastname="" birthdate="" tags="">
		<Sets>
			<Set name="106" date_pic="2012-10-12" date_vid="2012-07-06" tags=""/>
			<Set name="118" date_pic="" date_vid="2012-10-12" tags=""/>
		</Sets>
	</Model>
	
</Models>
