<?xml version="1.0" encoding="UTF-8"?>
<Models xmlns:xsi="http://www.w3.org/2001/XMLSchema-instance" xsi:noNamespaceSchemaLocation="../candydolldb.xsd" xmlns="">
	<Model firstname="Abrora" lastname="H" birthdate="" tags="">
		<Sets>
			<Set name="06" date_pic="2012-08-17" date_vid="2012-07-13" tags=""/>
		</Sets>
	</Model>
	<Model firstname="Alissa" lastname="P" birthdate="2003-08-20" tags="">
		<Sets>
			<Set name="15" date_pic="2012-08-17" date_vid="2012-08-03" tags=""/>
		</Sets>
	</Model>
	<Model firstname="Hanna" lastname="F" birthdate="2002-04-22" tags="">
		<Sets>
			<Set name="13" date_pic="2012-08-17" date_vid="2012-07-20" tags=""/>
		</Sets>
	</Model>
	<Model firstname="Katie" lastname="M" birthdate="2001-12-18" tags="">
		<Sets>
			<Set name="18" date_pic="2012-08-03" date_vid="2012-08-17" tags=""/>
			<Set name="19" date_pic="2012-08-17" date_vid="" tags=""/>
		</Sets>
	</Model>	
	<Model firstname="Lexi" lastname="G" birthdate="" tags="">
		<Sets>
			<Set name="01" date_pic="2012-07-27" date_vid="2012-08-17" tags=""/>
		</Sets>
	</Model>
	<Model firstname="Marina" lastname="T" birthdate="" tags="">
		<Sets>
			<Set name="04" date_pic="" date_vid="2012-08-17" tags=""/>
		</Sets>
	</Model>
	<Model firstname="Suisan" lastname="A" birthdate="" tags="">
		<Sets>
			<Set name="01" date_pic="" date_vid="2012-08-17" tags=""/>
		</Sets>
	</Model>
	<Model firstname="VIP" lastname="" birthdate="" tags="">
		<Sets>
			<Set name="98" date_pic="2012-08-17" date_vid="2012-05-11" tags=""/>
			<Set name="112" date_pic="" date_vid="2012-08-17" tags=""/>
		</Sets>
	</Model>
	<Model firstname="Promotions">
		<Sets>
			<Set name="Sample06"/>
		</Sets>
	</Model>
</Models>