<?xml version="1.0" encoding="UTF-8"?>
<Models xmlns:xsi="http://www.w3.org/2001/XMLSchema-instance" xsi:noNamespaceSchemaLocation="candydolldb.xsd" xmlns="">
<Model firstname="Promotions" lastname="" birthdate="" tags="">
	<Sets>
		<Set name="Promotion01" date_pic="" date_vid="" tags="Oksana02, LarisaH07, Catsute01, ValeriaL12, SvetlanaT04, VictoriaD01, SP_Bloomers01, UlyanaM03, VictoriaS01, SashaL01, SP_Alice01, KaterynaV01, SP_Sailor01, SP_Alice02, UlyanaA02, SvetlanaT05, LarisaH01, SP_Housemaid01, VictoriaD02, ValeriaL01, YuliyaS01, KaterynaV02, SvetlanaT01"/>
		<Set name="Promotion02" date_pic="" date_vid="" tags="ValeriyaL02, ValeriyaL07, KaterynaV06, ValeriyaL03, AnnaT08, AnnaT02, IrynaM05, AnnaT09, IrynaM02, SashaD03, Sashal08, SashaL04, YuliyaS02, VictoriaD04, AnastasiaS01, SvetlanaT03, LarisaH04, SashaD07, AlinaG03, UlyanaM02, YuliyaS03, SashaD06, AlinaG01, OlgaS01, AnnaZ05, YuliyaZ03, OlgaS02, AnnaT01, AnnaT03, AlinaG07(missing), AnastasiaS06, ValeriyaL08, SashaD01, SashaD02, AnnaZ01, AlinaG06, AnnaT05(missing), UlyanaM06, YuliyaS10, ValeriyaL05, Valeriya06(missing), UlyanaM07, SashaL02"/>
		<Set name="Promotion03" date_pic="" date_vid="" tags="MashaS06, AlyonaR01, VikaZ02, JuliyaR03, IrinaB06"/>
		<Set name="Promotion04" date_pic="" date_vid="" tags="MashaS02, JuliyaR01, AlyonaR02, InnaL01, VikaZ06, AlyonaR06, JuliyaR04, MashaS01, AlyonaR05, VikaZ03, JuliyaR02"/>
		<Set name="Promotion05" date_pic="" date_vid="" tags="AlyonaR03, MashaP01, MashaS10, LeraC01, IrinaB01, OlyaY06, AlyonaR04, AlyonaG01, IrinaB04, AlyonaR03, OlyaY04, LeraC02"/>
		<Set name="Promotion06" date_pic="" date_vid="" tags="VikaZ07, AlyonaR09, MashaS08, InnaL10, IrinaB07, MashaS09"/>
		<Set name="Promotion07" date_pic="" date_vid="" tags="AlyonaR09, AnastasiaK02, InnaL09, VikaZ08, MashaP05, MashaS09, AnastasiaK04, AlyonaR08"/>
		<Set name="Promotion08" date_pic="" date_vid="" tags="AnjelikaL01, MonikaD01, PionaP01, ElisaM01, NinaT01, BiyankaS01, OlyaY11, IrinaB10, SonyaM01, MashaS11"/>
		<Set name="Promotion09" date_pic="" date_vid="" tags="BiyankaS01, VioletaK02, ElizabetaS02, OlyaY12, PionaP02, VikaZ12, SonyaM02, AlyonaR11, AnjelikaL02"/>
		<Set name="Promotion10" date_pic="" date_vid="" tags="VikaZ13, MargaritaD04, AnjelikaL04, VioletaK04, OlyaY13, PionaP04, SofiyaY03, ElizabetaS05, PionaP05, VikaZ14, ElizabetaS03, MashaS13, SonyaM03"/>
		<Set name="Promotion11" date_pic="" date_vid="" tags="AnjelikaL06, VioletaK06, VioletaK07, MonikaD06, OlyaY14, PionaP06, BiyankaS04, ElisaM04, MonikaD07, AnjelikaL08, AlyonaR13, MashaS14, ElizabetaS06"/>
		<Set name="Promotion12" date_pic="" date_vid="" tags="VioletaK09, ElizabetaS09, VikaZ18, IrinaB14, ElisaM05, MashaS15, VikaZ20, RitaK05, BiyankaS05, ElizabetaS10, PionaP10, VikaZ19, MonikaD09, NinaT05, VioletaK10"/>
		<Set name="Promotion13" date_pic="" date_vid="" tags="SharlottaS01, VikaZ21, LiliyaY01, MilenaS01, PionaP11, VioletaK11, LiliyaY02, LauraB02, AnjelikaL11, LauraB02"/>
		<Set name="Promotion14" date_pic="" date_vid="" tags="VikaZ22, LauraB04, MilenaS02, PionaP12, SyuzannaR02, SharlottaS04, JuliyaR11, LiliyaY03"/>
		<Set name="Promotion15" date_pic="" date_vid="" tags="ElizabetaS13, LiliyaY06, SharlottaS08, ZinaB03, VioletaK03, SilviyaR03, LauraB04, MilenaS03"/>
		<Set name="Promotion16" date_pic="" date_vid="" tags="VioletaK14, SharlottaS12, PionaP14, MilenaS04, MayaL04, LiliyaY07, JuliyaR13, ElizabetaS14, ElisaM09, SharlottaS11"/>
		<Set name="Promotion17" date_pic="" date_vid="" tags="SyuzannaR05, ZinaB05, ElizabetaS15, LiliyaY10, VikaZ25, SharlottaS15, PionaP15, MilenaS05, LauraB09"/>
		<Set name="Promotion18" date_pic="" date_vid="" tags="SonyaM07, SharlottaS17, LiliyaY07, ViolettaK16, MayaL06, AliceL01, EvaG01, AnitaD06, ElenaV01, SofiyaZ06, PionaP16, NatashaC03"/>
		<Set name="Promotion19" date_pic="" date_vid="" tags="NatashaC06, PionaP17, SonyaM11, SharlottaS18, SofiyaV07, LiliyaY12"/>
		<Set name="Promotion20" date_pic="" date_vid="" tags="SonyaM14, MayaL13, SharlottaS20, AnitaD08, SofiyaV08, LauraB13, AliceL03, PionaP18, NatashaC09"/>
		<Set name="Promotion21" date_pic="" date_vid="" tags="SonyaM16, MayaL16, AliceL04, LiliyaY14, VioletaK19, SharlottaS22, RitaK09, SofiyaV09, NatashaC10"/>
		<Set name="Promotion22" date_pic="" date_vid="" tags="EvaG05, LauraB15, LiliyaY15, AnitaD10, VikaZ30, PionaP20, BiyankaS10, SonyaM20, SharlottaS24, VioletaK20, NatashaC13"/>
		<Set name="Promotion23" date_pic="" date_vid="" tags="DianaM01, LiliyaY17, ChrisG01, ValensiyaS05, LinaI02, MayaL19, NatashaC14, LauraB17"/>
		<Set name="Promotion24" date_pic="" date_vid="" tags="LinaI04, ElisaM12, MayaL21, LiliyaY18, SanyaV03, LauraB18, EmmaM02, Valensiya14, DianaM02"/>
		<Set name="Promotion25" date_pic="" date_vid="" tags="LiliyaY21, ChrisG04, SarahK03, MarieA03, ElisaM13, AlyonaR17, SanyaV05, LauraB20, LinaI08"/>
		<Set name="Promotion26" date_pic="" date_vid="" tags="LauraB22, SanyaV07, AliceL12, SarahK04, MarieA04, NatashaC17, ElisaM14, MayaL25, ChrisG05, LiliyaY23, LinaI12"/>
		<Set name="Promotion27" date_pic="" date_vid="" tags="LauraB25, LiliyaY24, unknown (MayaL and LiliyaY in Cosplay), YuliyaK01, MayaL28, ValensiyaS26, LauraB24, unknown (LiliyaY, LauraB, ValensiyaS)"/>
		<Set name="Promotion28" date_pic="" date_vid="" tags="ValensiyaS29, Anjelika16, YuliyaK03, SofiyaV011, MariyaD01, AlisaA01, VikaZ31, LidiyaA01, LiliyaY27, LauraB26"/>
		<Set name="Promotion29" date_pic="" date_vid="" tags="LinaI14, EricaR02, LiliyaY28, VikaZ32, SanyaV10, YuliyaK04, ValensiyaS31, MayaL31"/>
		<Set name="Promotion30" date_pic="" date_vid="" tags="EricaR04, YuliyaK06, MayaL33, VikaZ33, LiliyaY29, LidiyaA04, VikaZ34, YuliyaK07"/>
		<Set name="Promotion31" date_pic="" date_vid="" tags="YuliyaK10, SofiyaV13, LinaI16, AnjelikaL19, YuliyaK08, ValensiyaS35, SanyaV11, DianaM08"/>
	</Sets>
</Model>
</Models>
