<?xml version="1.0" encoding="UTF-8"?>
<Models xmlns:xsi="http://www.w3.org/2001/XMLSchema-instance" xsi:noNamespaceSchemaLocation="../candydolldb.xsd" xmlns="">

	<Model firstname="Anastasia" lastname="R" birthdate="1999-04-03" tags="">
		<Sets>
			<Set name="09" date_pic="2012-10-26" date_vid="2012-10-12" tags=""/>
		</Sets>
	</Model>
	
	<Model firstname="Bianca" lastname="M" birthdate="" tags="">
		<Sets>
			<Set name="01" date_pic="" date_vid="2012-10-26" tags=""/>
		</Sets>
	</Model>
	
	<Model firstname="Eva" lastname="R" birthdate="" tags="">
		<Sets>
			<Set name="01" date_pic="" date_vid="2012-10-26" tags=""/>
		</Sets>
	</Model>
	
	<Model firstname="Hanna" lastname="F" birthdate="2002-04-22" tags="">
		<Sets>
			<Set name="16" date_pic="" date_vid="2012-10-26" tags=""/>
		</Sets>
	</Model>
	
	<Model firstname="Katie" lastname="M" birthdate="2001-12-18" tags="">
		<Sets>
			<Set name="25" date_pic="2012-10-05" date_vid="2012-10-26" tags=""/>
		</Sets>
	</Model>
	
	<Model firstname="Khloe" lastname="R" birthdate="" tags="">
		<Sets>
			<Set name="04" date_pic="2012-10-26" date_vid="" tags=""/>
		</Sets>
	</Model>
	
	<Model firstname="Lauren" lastname="F" birthdate="" tags="">
		<Sets>
			<Set name="01" date_pic="2012-10-26" date_vid="2012-10-12" tags=""/>
		</Sets>
	</Model>
	
	<Model firstname="Nika" lastname="V" birthdate="" tags="">
		<Sets>
			<Set name="03" date_pic="2012-10-26" date_vid="" tags=""/>
		</Sets>
	</Model>

	<Model firstname="VIP" lastname="" birthdate="" tags="">
		<Sets>
			<Set name="108" date_pic="2012-10-26" date_vid="2012-07-20" tags=""/>
			<Set name="120" date_pic="" date_vid="2012-10-26" tags=""/>
		</Sets>
	</Model>
	
</Models>
