<?xml version="1.0" encoding="UTF-8"?>
<Models xmlns:xsi="http://www.w3.org/2001/XMLSchema-instance" xsi:noNamespaceSchemaLocation="../candydolldb.xsd" xmlns="">

	<Model firstname="Bella" lastname="K" birthdate="1999-04-11" tags="">
		<Sets>
			<Set name="06" date_pic="2012-08-24" date_vid="" tags=""/>
		</Sets>
	</Model>

	<Model firstname="Katie" lastname="M" birthdate="2001-12-18" tags="">
		<Sets>
			<Set name="20" date_pic="2012-08-24" date_vid="" tags=""/>
		</Sets>
	</Model>	
	
	<Model firstname="Margaret" lastname="M" birthdate="" tags="">
		<Sets>
			<Set name="06" date_pic="2012-08-24" date_vid="" tags=""/>
		</Sets>
	</Model>

	<Model firstname="Sabina" lastname="C" birthdate="2001-06-25" tags="">
		<Sets>
			<Set name="09" date_pic="2012-08-24" date_vid="2012-07-06" tags=""/>
		</Sets>
	</Model>

	<Model firstname="Alissa" lastname="P" birthdate="2003-08-20" tags="">
		<Sets>
			<Set name="17" date_pic="" date_vid="2012-08-24" tags=""/>
		</Sets>
	</Model>

	<Model firstname="Maryam" lastname="K" birthdate="" tags="">
		<Sets>
			<Set name="02" date_pic="2012-07-06" date_vid="2012-08-24" tags="bloomers, blue carpet, blue shoes, chair, hair barrette, hair ties, ponytail, red drapes, ringer t-shirt, skipping rope, striped socks"/>
		</Sets>
	</Model>

	<Model firstname="Mila" lastname="L" birthdate="1997-11-27" tags="">
		<Sets>
			<Set name="01" date_pic="2012-06-15" date_vid="2012-08-24" tags="black, black shoes, blue drapes, chair, maid, white, white stockings"/>
		</Sets>
	</Model>

	<Model firstname="Suisan" lastname="A" birthdate="" tags="">
		<Sets>
			<Set name="02" date_pic="" date_vid="2012-08-24" tags=""/>
		</Sets>
	</Model>
	
	<Model firstname="VIP" lastname="" birthdate="" tags="">
		<Sets>
			<Set name="99" date_pic="2012-08-24" date_vid="2012-05-18" tags=""/>
			<Set name="113" date_pic="" date_vid="2012-08-24" tags=""/>
		</Sets>
	</Model>
</Models>